{
  "schema": "workflow-bootstrap-release/v1",
  "version": "1.0.0",
  "generated_utc": "2026-08-02T18:35:20.8542521+00:00",
  "files": [
    {
      "path": "bootstrap.cmd",
      "sha256": "dba6e325270547f4436a464ddf33cd17c40584b35078d6d5127aef689a85efdd",
      "size": 357
    },
    {
      "path": "Bootstrap.ps1",
      "sha256": "9822a2297592da68dfab1bc4c57d09c36c9a89b2faf58b4006b659a71fb2990e",
      "size": 59372
    },
    {
      "path": "catalog/compatibility.json",
      "sha256": "b1a879c276ad8d32e4322a1bbc3b6e7984347359a166326ff672db12ff0be951",
      "size": 105120
    },
    {
      "path": "CHANGELOG.md",
      "sha256": "d73a935c47ba6ced9a7b9115af1a24746167499e49b92da7edf0049cbb5b3668",
      "size": 1383
    },
    {
      "path": "docs/ANALYSE.md",
      "sha256": "f4be593a380198d5f7dfb02350ae33c955ddd8b62443d9ddc34a1ded8687d2aa",
      "size": 9835
    },
    {
      "path": "docs/ARCHITEKTUR.md",
      "sha256": "366c6ee9bb46cd76df842f8c71c29a49dbed96d28ecbae2d91b9ea1b3b1c44a8",
      "size": 3930
    },
    {
      "path": "docs/BOOTSTRAP-MANAGER.md",
      "sha256": "eeebcd56c35a8925fa609db005a9dc4237f723d6560265b0619d1d8de7abd36a",
      "size": 5062
    },
    {
      "path": "docs/MIGRATION.md",
      "sha256": "5cd407c19deaa2f5f6dc28a07009eb8833a55ad94c548f0215c50b391d46217c",
      "size": 2867
    },
    {
      "path": "docs/README-UNIVERSAL-INTRO.md",
      "sha256": "0a809b6e2ea3da91259918f22a0daa759029ee8039707bc2230c2262dc9d4f4d",
      "size": 13555
    },
    {
      "path": "docs/ROADMAP.md",
      "sha256": "07676d7bec31e07ce9333ffbacd324f83b081e5931f5a9673cc8b32fbc8f1e29",
      "size": 6910
    },
    {
      "path": "docs/SECURITY.md",
      "sha256": "77629bd42c952671581e3d8171c314729777f60c8122cba57aa6911bdf8ee8ce",
      "size": 2269
    },
    {
      "path": "docs/WORKFLOW-V2.md",
      "sha256": "6dea1e135c4272c565cd851451b4efdcca0a8df2382527bde582f8504c4bd672",
      "size": 2980
    },
    {
      "path": "profiles/chess/catalog/commands.json",
      "sha256": "70be1da666507f8b00174602235a5871ed0ed1d57b7a98172af0b97021e7052f",
      "size": 31417
    },
    {
      "path": "profiles/chess/catalog/functions.json",
      "sha256": "372696ba1b72a916bec622104a669297a454ddd59b19c8a8299deeb415a0a46c",
      "size": 139766
    },
    {
      "path": "profiles/chess/config.default.json",
      "sha256": "f651afe9972786cb817bc0050d9ffe8e663a97a2d678457c59a873247dd0994e",
      "size": 2025
    },
    {
      "path": "profiles/chess/profile.json",
      "sha256": "08f9f27e45f63910296e4dcb9a82af67dc57435bb8c4087506f8496fa5666835",
      "size": 6392
    },
    {
      "path": "profiles/chess/runtime/bin/legacy-ci.ps1",
      "sha256": "b3d939cc7e42e81b05221818bbf3f560ca38f181c7bf4abe51a4fd3b9482e4d4",
      "size": 19645
    },
    {
      "path": "profiles/chess/runtime/bin/modules/browser-logic.ps1",
      "sha256": "5951f6ed1e881eb4e31c9a1eeaa27ed53748be1b2ffe5c77dee07f312d193fc8",
      "size": 21533
    },
    {
      "path": "profiles/chess/runtime/bin/modules/ci-commands-main.ps1",
      "sha256": "619c468615b8d2520439d1b5c233cdca3f87d27183efac146cbeeea4a762f9ce",
      "size": 214031
    },
    {
      "path": "profiles/chess/runtime/bin/modules/ci-core.ps1",
      "sha256": "8b0f161dcd96ef7e617fa457c9bdc27c494378758064b07d439b1b944ad5687b",
      "size": 9923
    },
    {
      "path": "profiles/chess/runtime/bin/modules/core-utils.ps1",
      "sha256": "f34e304d6152d6509fd8e989788049af37a07a37f5e0889375728e66cccd5114",
      "size": 32523
    },
    {
      "path": "profiles/chess/runtime/bin/modules/critic-logic.ps1",
      "sha256": "0c87f1326624841abd9b205e0badc8df18852eff559df96688ef104432d36fb2",
      "size": 9864
    },
    {
      "path": "profiles/chess/runtime/bin/modules/observer-logic.ps1",
      "sha256": "e8ab86d42a6416cc016551a4d96e6ef7e0feb11bd00c70788c0792cf48db49d7",
      "size": 20565
    },
    {
      "path": "profiles/chess/runtime/bin/modules/project-logic.ps1",
      "sha256": "6b062ac0e65864515c9a5b343d487469c02e5ff1f82b6d58b303ed2e9a61fdeb",
      "size": 8767
    },
    {
      "path": "profiles/chess/runtime/bin/modules/sonar-logic.ps1",
      "sha256": "c7194839f305dc2a23a3979ced586c4c1c000a2494c6d5173e200eb4b610d181",
      "size": 6566
    },
    {
      "path": "profiles/chess/runtime/bin/modules/todo-engine.ps1",
      "sha256": "76a24a8a878f161f95138e7129c107e4e0c53faf7d59727ad095a0da4a53cde7",
      "size": 28589
    },
    {
      "path": "profiles/chess/runtime/bin/modules/toolchain-gradle.ps1",
      "sha256": "189ae3a4122b2c8366d52ecf30a29f094e3a5b4db52fbf4670bde38b9eb0de97",
      "size": 24971
    },
    {
      "path": "profiles/chess/runtime/bin/modules/toolchain-java.ps1",
      "sha256": "ad0893eed8bde6a460f1686fc12a9b2daf4f78bde1a424d7f6736a4b83a7492a",
      "size": 8864
    },
    {
      "path": "profiles/chess/runtime/bin/modules/ui-commands.ps1",
      "sha256": "4dfbe01271a4befe7d69b7d7cb2d154543d04f220306e7f9f7ef97ea6c5f0670",
      "size": 11396
    },
    {
      "path": "profiles/chess/runtime/bin/modules/verify-logic.ps1",
      "sha256": "851fcc91507e20c251af730fed246c33738984e9e2fee3cab5f9eadebbd2ad07",
      "size": 14970
    },
    {
      "path": "profiles/chess/runtime/bin/start_dev_server_internal.ps1",
      "sha256": "40c4035dabd19cc78a4a8c0b98b16de06190d2fbeed1b2e5a60c045e0ac30777",
      "size": 716
    },
    {
      "path": "profiles/chess/runtime/bin/start_dev.ps1",
      "sha256": "5ca50a38ae83a8d5f5f2c8eea839372eb32cb2c4818132f7749da023c2b11c3e",
      "size": 806
    },
    {
      "path": "profiles/chess/runtime/bin/start_devserver.ps1",
      "sha256": "c55d72059e64444191f6bb77a538d4daa280b68284633cd6e459de2df2e50cd5",
      "size": 1559
    },
    {
      "path": "profiles/chess/runtime/bin/start_ktor.ps1",
      "sha256": "cc00925cf4ced624b56c951e47351df6940085356e8b13b56da421bc77d1fa71",
      "size": 813
    },
    {
      "path": "profiles/chess/runtime/bin/start-sonar.ps1",
      "sha256": "070d3f82c80372d2fab5d1b95170e9abadf6880ce5b14cc641a7fc938ab9c953",
      "size": 1569
    },
    {
      "path": "profiles/sound-profile/catalog/commands.json",
      "sha256": "66dad107a3a862ce694480e39cb3aa23685e98f4a052ae37e039a979aadfe722",
      "size": 27475
    },
    {
      "path": "profiles/sound-profile/catalog/functions.json",
      "sha256": "5ee281c46af3ba7e0d8aa1774d7657d0422ac9cc4691456ff5557915f2df06bf",
      "size": 122667
    },
    {
      "path": "profiles/sound-profile/config.default.json",
      "sha256": "86c2ff9339145ee76dbab2fcd60e2359b0e82bfdb5c802104660267c5247e284",
      "size": 827
    },
    {
      "path": "profiles/sound-profile/profile.json",
      "sha256": "6014ae13d129f8f1ca737789531d772290763a9096762cbe00ca0a60e03e8caf",
      "size": 6440
    },
    {
      "path": "profiles/sound-profile/runtime/bin/legacy-ci.ps1",
      "sha256": "f16b1cc03ca00dc3195ce8270e6a7a2794b01f5729a1e4975f12e5538814e9f2",
      "size": 19398
    },
    {
      "path": "profiles/sound-profile/runtime/bin/modules/browser-logic.ps1",
      "sha256": "b0f9344efa01c1fb3aa7abe7eb8d708c65b02d7e43063f0d0bd55ad438fc2723",
      "size": 15329
    },
    {
      "path": "profiles/sound-profile/runtime/bin/modules/ci-commands-main.ps1",
      "sha256": "96c54f2629d076414265e3188255dc232fadc6f211a79e4e3f1f999b032b17f5",
      "size": 71741
    },
    {
      "path": "profiles/sound-profile/runtime/bin/modules/ci-core.ps1",
      "sha256": "9200d17d3da8dd658cceff7490bb47d5bff4e2b8ab7c3789c4f38870851ef272",
      "size": 10141
    },
    {
      "path": "profiles/sound-profile/runtime/bin/modules/core-utils.ps1",
      "sha256": "00f816e274bfcbed91152e2cdc722e75392853f750509308ee9ff4953d519bff",
      "size": 14691
    },
    {
      "path": "profiles/sound-profile/runtime/bin/modules/critic-logic.ps1",
      "sha256": "05a9eec7153f53817e7fdb51ebf94ab0e7aa9c957fe5fdce6976a0522f7436a7",
      "size": 10077
    },
    {
      "path": "profiles/sound-profile/runtime/bin/modules/observer-logic.ps1",
      "sha256": "e8ab86d42a6416cc016551a4d96e6ef7e0feb11bd00c70788c0792cf48db49d7",
      "size": 20565
    },
    {
      "path": "profiles/sound-profile/runtime/bin/modules/project-logic.ps1",
      "sha256": "265c00299ba05fee483b81aa8581c861a99b9c3c2ff3d0ad63b49419318aa6d7",
      "size": 11880
    },
    {
      "path": "profiles/sound-profile/runtime/bin/modules/sonar-logic.ps1",
      "sha256": "93ea78902b609fb5bdccb7d4be32a3092a0cbe480c9e86747ac7f5510619f49c",
      "size": 19049
    },
    {
      "path": "profiles/sound-profile/runtime/bin/modules/todo-engine.ps1",
      "sha256": "23e4d443f8ed32ecb9991507d64a97746e5b2a4dd4cf308e5ba1ae868dd9054e",
      "size": 24957
    },
    {
      "path": "profiles/sound-profile/runtime/bin/modules/toolchain-gradle.ps1",
      "sha256": "142abde92561ed00390a9ce2ec26352c0caf3c3aee745b650ebaa41cac74ecb5",
      "size": 13226
    },
    {
      "path": "profiles/sound-profile/runtime/bin/modules/toolchain-java.ps1",
      "sha256": "ad0893eed8bde6a460f1686fc12a9b2daf4f78bde1a424d7f6736a4b83a7492a",
      "size": 8864
    },
    {
      "path": "profiles/sound-profile/runtime/bin/modules/ui-commands.ps1",
      "sha256": "4dfbe01271a4befe7d69b7d7cb2d154543d04f220306e7f9f7ef97ea6c5f0670",
      "size": 11396
    },
    {
      "path": "profiles/sound-profile/runtime/bin/modules/verify-logic.ps1",
      "sha256": "8290b22f0775cbb906fd700b1cb36e7fb876aa6150e651e35c98c80693a78274",
      "size": 18849
    },
    {
      "path": "profiles/sound-profile/runtime/bin/start_dev_server_internal.ps1",
      "sha256": "d9d9cd47e001d01afdf4b8f4457b3ede2813690cdffc5a9c79137a1039c392b1",
      "size": 652
    },
    {
      "path": "profiles/sound-profile/runtime/bin/start_dev.ps1",
      "sha256": "31dfae964cfe2b6b70ebc2ff7834acd9e576dc736278545b5ed7f74dc47721b6",
      "size": 752
    },
    {
      "path": "profiles/sound-profile/runtime/bin/start_devserver.ps1",